,created_utc,is_crosspostable,is_self,is_video,locked,media_only,over_18,subreddit_id,subreddit_name_prefixed,subreddit_subscribers,title,permalink,total_awards_received,downs,gilded,num_comments,num_crossposts,num_reports,ups
0,1599240870.0,False,False,False,False,False,False,t5_2s46r,r/UBreddit,14892,UBIT is safe,/r/UBreddit/comments/imkf0n/ubit_is_safe/,2,0,0,7,0,,502
1,1598811422.0,False,False,False,False,False,False,t5_2s46r,r/UBreddit,14892,WEEK ONE!!! REMEMBER TO WEAR YOUR MASKS AND POST SPEEDRUNS OF YOUR DAILY HEALTH CHECKS!!!! GIVE IT UP FOR WEEK ONE!!!!!!!!,/r/UBreddit/comments/ijhhd5/week_one_remember_to_wear_your_masks_and_post/,1,0,0,16,0,,474
2,1582410628.0,False,False,False,False,False,False,t5_2s46r,r/UBreddit,14892,What the last 2 minutes of lecture looks like to your professor,/r/UBreddit/comments/f8019t/what_the_last_2_minutes_of_lecture_looks_like_to/,4,0,1,21,1,,459
3,1574357756.0,False,False,False,False,False,False,t5_2s46r,r/UBreddit,14892,The SU Bull today,/r/UBreddit/comments/dzmrbc/the_su_bull_today/,1,0,1,45,0,,443
4,1580559353.0,False,False,False,False,False,False,t5_2s46r,r/UBreddit,14892,Logging into MyUB be like.,/r/UBreddit/comments/ex5bsz/logging_into_myub_be_like/,0,0,0,27,0,,437
5,1599145113.0,False,False,False,False,False,False,t5_2s46r,r/UBreddit,14892,That Daily health check got us covered,/r/UBreddit/comments/iluzv4/that_daily_health_check_got_us_covered/,3,0,0,8,0,,420
6,1584029885.0,False,False,False,False,False,False,t5_2s46r,r/UBreddit,14892,Please resume classes everyone.....,/r/UBreddit/comments/fhiuw2/please_resume_classes_everyone/,0,0,0,3,0,,425
7,1585713948.0,False,False,False,False,False,False,t5_2s46r,r/UBreddit,14892,Heard other schools are making their campuses in minecraft due to the coronavirus so thought I'd make UB in minecraft. Can you guess this building so far???,/r/UBreddit/comments/fssaoi/heard_other_schools_are_making_their_campuses_in/,0,0,0,32,0,,395
8,1617289073.0,False,False,False,False,False,False,t5_2s46r,r/UBreddit,14892,UB.... Probably,/r/UBreddit/comments/mhx3jy/ub_probably/,5,0,0,11,0,,391
9,1583956309.0,False,False,False,False,False,False,t5_2s46r,r/UBreddit,14892,Actual representation of UB administration right now,/r/UBreddit/comments/fh35ru/actual_representation_of_ub_administration_right/,0,0,0,29,0,,382
10,1572585732.0,False,False,True,False,False,False,t5_2s46r,r/UBreddit,14892,That's got to be the best pirate I've ever seen,/r/UBreddit/comments/dpzyjx/thats_got_to_be_the_best_pirate_ive_ever_seen/,1,0,0,17,1,,383
11,1600642842.0,False,False,False,False,False,False,t5_2s46r,r/UBreddit,14892,Rest in Peace.,/r/UBreddit/comments/iwod8q/rest_in_peace/,4,0,0,23,0,,373
12,1643831697.0,False,False,False,False,False,False,t5_2s46r,r/UBreddit,14892,"Congrats UB, you built a giant apple store",/r/UBreddit/comments/siy53c/congrats_ub_you_built_a_giant_apple_store/,1,0,0,78,0,,372
13,1619722649.0,False,False,False,False,False,False,t5_2s46r,r/UBreddit,14892,Dr. Sand Be Like,/r/UBreddit/comments/n1bfer/dr_sand_be_like/,3,0,0,17,0,,371
14,1574446799.0,False,True,False,False,False,False,t5_2s46r,r/UBreddit,14892,HONG KONG SUPPORT UPVOTE PARTY!,/r/UBreddit/comments/e04xau/hong_kong_support_upvote_party/,1,0,1,16,0,,364
15,1603298061.0,False,False,False,False,False,False,t5_2s46r,r/UBreddit,14892,Protector of Lockwood,/r/UBreddit/comments/jfgbfq/protector_of_lockwood/,1,0,0,19,0,,366
16,1589657636.0,False,False,False,False,False,False,t5_2s46r,r/UBreddit,14892,for our seniors,/r/UBreddit/comments/gl0th8/for_our_seniors/,1,0,0,27,0,,361
17,1600136317.0,False,False,False,False,False,False,t5_2s46r,r/UBreddit,14892,The General mood,/r/UBreddit/comments/iszo9k/the_general_mood/,2,0,0,9,0,,355
18,1573404482.0,False,False,False,False,False,False,t5_2s46r,r/UBreddit,14892,dEwEy HaLl Is oN fIrE,/r/UBreddit/comments/dudtbr/dewey_hall_is_on_fire/,0,0,0,18,0,,358
19,1583863134.0,False,False,False,False,False,False,t5_2s46r,r/UBreddit,14892,walking up the hill to clemens be like...,/r/UBreddit/comments/fghzk3/walking_up_the_hill_to_clemens_be_like/,1,0,0,12,0,,353
20,1605499080.0,False,False,False,False,False,False,t5_2s46r,r/UBreddit,14892,This semester got me like,/r/UBreddit/comments/jv02zj/this_semester_got_me_like/,1,0,0,2,0,,348
21,1583164104.0,False,False,False,False,False,False,t5_2s46r,r/UBreddit,14892,Me_irl,/r/UBreddit/comments/fcdylo/me_irl/,0,0,0,19,1,,343
22,1602609281.0,False,False,False,False,False,False,t5_2s46r,r/UBreddit,14892,"This has to be the most difficult semester so far. Respect for y’all students, TAs and professors who are trying to keep it together. I’ve basically given up at this point 😪",/r/UBreddit/comments/jahtkc/this_has_to_be_the_most_difficult_semester_so_far/,2,0,0,25,0,,342
23,1583337846.0,False,False,False,False,False,False,t5_2s46r,r/UBreddit,14892,External Conflict,/r/UBreddit/comments/fdf3zi/external_conflict/,2,0,0,45,0,,343
24,1614056733.0,False,False,False,False,False,False,t5_2s46r,r/UBreddit,14892,Update: Juan has been found and is back home,/r/UBreddit/comments/lq9vo9/update_juan_has_been_found_and_is_back_home/,3,0,0,16,0,,339
25,1571061969.0,False,False,False,False,False,False,t5_2s46r,r/UBreddit,14892,Me next to the reflective windows outside Capen,/r/UBreddit/comments/dhr17a/me_next_to_the_reflective_windows_outside_capen/,0,0,0,12,0,,331
26,1618618219.0,False,False,False,False,False,False,t5_2s46r,r/UBreddit,14892,Thought this might fit here,/r/UBreddit/comments/msfyzd/thought_this_might_fit_here/,0,0,0,11,0,,332
27,1608312508.0,False,True,False,False,False,False,t5_2s46r,r/UBreddit,14892,A Note From a TA,/r/UBreddit/comments/kfphnk/a_note_from_a_ta/,7,0,1,23,0,,336
28,1574807767.0,False,False,False,False,False,False,t5_2s46r,r/UBreddit,14892,Coming from your friendly UB Spider-Man! Don't forget the hyphen!,/r/UBreddit/comments/e25xpr/coming_from_your_friendly_ub_spiderman_dont/,2,0,0,14,0,,333
29,1604947176.0,False,False,False,False,False,False,t5_2s46r,r/UBreddit,14892,It really do be that way,/r/UBreddit/comments/jr3e6j/it_really_do_be_that_way/,3,0,0,10,0,,331
30,1638822543.0,False,False,False,False,False,False,t5_2s46r,r/UBreddit,14892,Just heading to my class.,/r/UBreddit/comments/ragvcr/just_heading_to_my_class/,3,0,0,14,0,,326
31,1597855916.0,False,False,True,False,False,False,t5_2s46r,r/UBreddit,14892,"I hate TikTok, but I just want ya’ll to know...",/r/UBreddit/comments/icrfg0/i_hate_tiktok_but_i_just_want_yall_to_know/,1,0,0,38,2,,315
32,1600048826.0,False,False,False,False,False,False,t5_2s46r,r/UBreddit,14892,"WEEK THREE!! WEAR YOUR MASK OR BE SENT TO QUARANTANAMO BAY, COMRADE!! GIVE IT UP FOR WEEK THREE IN THE UB PEOPLE'S REPUBLIC!!!!!",/r/UBreddit/comments/isbq9y/week_three_wear_your_mask_or_be_sent_to/,5,0,0,9,0,,318
33,1568659453.0,False,False,False,False,False,False,t5_2s46r,r/UBreddit,14892,I met a legend!,/r/UBreddit/comments/d54kqt/i_met_a_legend/,0,0,0,42,0,,315
34,1604099848.0,False,False,False,False,False,False,t5_2s46r,r/UBreddit,14892,Last day as UB_Chiropractic,/r/UBreddit/comments/jl7jtp/last_day_as_ub_chiropractic/,2,0,2,7,0,,316
35,1611324753.0,False,False,False,False,False,False,t5_2s46r,r/UBreddit,14892,I am once again asking for a chicken broccoli alfredo,/r/UBreddit/comments/l2oiqw/i_am_once_again_asking_for_a_chicken_broccoli/,1,0,0,23,0,,312
36,1606941599.0,False,False,False,False,False,False,t5_2s46r,r/UBreddit,14892,Waking up to stare at the computer for another 12 hours each day,/r/UBreddit/comments/k5hvbt/waking_up_to_stare_at_the_computer_for_another_12/,2,0,0,8,0,,312
37,1602720830.0,False,False,False,False,False,False,t5_2s46r,r/UBreddit,14892,Uhh guys??,/r/UBreddit/comments/jbcx0x/uhh_guys/,3,0,0,26,0,,312
38,1602507926.0,False,False,True,False,False,False,t5_2s46r,r/UBreddit,14892,they’re conglomerating,/r/UBreddit/comments/j9qiet/theyre_conglomerating/,1,0,0,16,0,,312
39,1595290241.0,False,False,False,False,False,False,t5_2s46r,r/UBreddit,14892,rip fees,/r/UBreddit/comments/hux20m/rip_fees/,0,0,0,7,0,,304
40,1633221450.0,False,False,False,False,False,False,t5_2s46r,r/UBreddit,14892,A Story Told In 3 Posts.,/r/UBreddit/comments/q073fa/a_story_told_in_3_posts/,3,0,0,7,0,,301
41,1616869473.0,False,False,False,False,False,False,t5_2s46r,r/UBreddit,14892,#pain,/r/UBreddit/comments/mejgwg/pain/,6,0,0,3,0,,306
42,1588870196.0,False,False,False,False,False,False,t5_2s46r,r/UBreddit,14892,I’ve been accepted. It’s an honor.,/r/UBreddit/comments/gfa7ql/ive_been_accepted_its_an_honor/,0,0,0,22,0,,301
43,1566823332.0,False,False,False,False,False,False,t5_2s46r,r/UBreddit,14892,WEEK 1!!!! EVERYONE GIVE IT UP FOR WEEK 1!!! WELCOME BACK FROM THE SUMMER HOPE IT WAS GOOD FOR EVERYONE!!!,/r/UBreddit/comments/cvnk7a/week_1_everyone_give_it_up_for_week_1_welcome/,0,0,0,12,0,,303
44,1584980835.0,False,False,False,False,False,False,t5_2s46r,r/UBreddit,14892,WEEK 8!!! WE GOT HIT WITH THE CORONAVIRUS OUTBREAK AND NOW WE ALL HAVE TO DO SCHOOL OR WORK FROM HOME!!! GOOD LUCK YA'LL AND HOPE WE ALL CAN GET THROUGH THIS SEMESTER IN ONE PIECE!!! ALSO PLEASE PRACTICE SOCIAL DISTANCING AT THIS TIME!!! EVERYBODY GIVE IT UP FOR WEEK 8!!!,/r/UBreddit/comments/fnmtpr/week_8_we_got_hit_with_the_coronavirus_outbreak/,0,0,0,18,0,,304
45,1599756025.0,False,False,False,False,False,False,t5_2s46r,r/UBreddit,14892,POV you're positive for COVID and Satish gives the order to keep cases below 100,/r/UBreddit/comments/iq6y20/pov_youre_positive_for_covid_and_satish_gives_the/,6,0,0,6,0,,299
46,1634953809.0,False,False,True,False,False,False,t5_2s46r,r/UBreddit,14892,Lockwood Vibes :-),/r/UBreddit/comments/qdvc7x/lockwood_vibes/,4,0,0,51,0,,301
47,1568806262.0,False,False,False,False,False,False,t5_2s46r,r/UBreddit,14892,Not All Heroes Wear Capes,/r/UBreddit/comments/d5we54/not_all_heroes_wear_capes/,0,0,0,22,0,,307
48,1605841423.0,False,False,False,False,False,False,t5_2s46r,r/UBreddit,14892,Mood🙂,/r/UBreddit/comments/jxhagt/mood/,0,0,0,14,0,,302
49,1574432672.0,False,False,False,False,False,False,t5_2s46r,r/UBreddit,14892,UB Stampede drivers when they pass by each other at Lee Loop,/r/UBreddit/comments/e01nb2/ub_stampede_drivers_when_they_pass_by_each_other/,0,0,0,6,0,,297
50,1608823101.0,False,False,False,False,False,False,t5_2s46r,r/UBreddit,14892,When you’ve been talking to someone for 6+ months and they don’t even say merry Christmas 😫😫😫,/r/UBreddit/comments/kjh22c/when_youve_been_talking_to_someone_for_6_months/,0,0,0,8,0,,296
51,1616609610.0,False,False,False,False,False,False,t5_2s46r,r/UBreddit,14892,I felt this in my soul.,/r/UBreddit/comments/mccj4t/i_felt_this_in_my_soul/,0,0,0,6,0,,297
52,1585680111.0,False,False,False,False,False,False,t5_2s46r,r/UBreddit,14892,It’s rough out here,/r/UBreddit/comments/fsik15/its_rough_out_here/,0,0,0,6,0,,292
53,1620009564.0,False,False,False,False,False,False,t5_2s46r,r/UBreddit,14892,WEEK 14!!!! ENJOY YOUR TRIP INTO THE FINALS PREP VOID!!!! THERE'S NO GOING BACK NOW!!!!!!! EVERYBODY GIVE IT UP FOR WEEK 14!!!!!!!!!! (AND FOR KRABS COMING BACK!),/r/UBreddit/comments/n3m1s0/week_14_enjoy_your_trip_into_the_finals_prep_void/,5,0,0,13,0,,293
54,1604012010.0,False,False,False,False,False,False,t5_2s46r,r/UBreddit,14892,:(,/r/UBreddit/comments/jkksd6/_/,0,0,0,11,0,,292
55,1631544013.0,False,False,False,False,False,False,t5_2s46r,r/UBreddit,14892,I need to make a sign or something,/r/UBreddit/comments/pngsjy/i_need_to_make_a_sign_or_something/,1,0,0,10,0,,289
56,1612985654.0,False,False,False,False,False,False,t5_2s46r,r/UBreddit,14892,3D Printed map of north campus,/r/UBreddit/comments/lh1okp/3d_printed_map_of_north_campus/,4,0,0,14,0,,286
57,1602124088.0,False,False,False,False,False,False,t5_2s46r,r/UBreddit,14892,I could not relate to a picture more than this one,/r/UBreddit/comments/j74t51/i_could_not_relate_to_a_picture_more_than_this_one/,0,0,0,7,0,,286
58,1599448698.0,False,False,False,False,False,False,t5_2s46r,r/UBreddit,14892,"WEEK TWO!!! ENJOY CLASSES ON LABOR DAY AND DON'T FORGET TO DROP THE ONES YOU'LL PROBABLY FAIL BY TUESDAY!!!! GIVE IT UP FOR WEEK TWO!!! (HOPEFULLY, THIS WON'T BE OUR LAST -- WEAR YOUR MASK!)",/r/UBreddit/comments/inzvjv/week_two_enjoy_classes_on_labor_day_and_dont/,2,0,0,9,0,,289
59,1611257523.0,False,False,False,False,False,False,t5_2s46r,r/UBreddit,14892,Because I can and no one can stop me,/r/UBreddit/comments/l25rot/because_i_can_and_no_one_can_stop_me/,6,0,0,14,0,,286
60,1582801660.0,False,False,False,False,False,False,t5_2s46r,r/UBreddit,14892,UB Following Regular Schedule for Feb 27,/r/UBreddit/comments/faaij8/ub_following_regular_schedule_for_feb_27/,0,0,0,25,0,,286
61,1612372013.0,False,False,False,False,False,False,t5_2s46r,r/UBreddit,14892,Pain.,/r/UBreddit/comments/lbscjs/pain/,0,0,0,10,0,,287
62,1610900272.0,False,False,False,False,False,False,t5_2s46r,r/UBreddit,14892,Return to Campus be like ....,/r/UBreddit/comments/kz99mb/return_to_campus_be_like/,4,0,0,5,0,,282
63,1601995480.0,False,False,False,False,False,False,t5_2s46r,r/UBreddit,14892,Just wanted to share some pics I’ve taken from my dorm in Wilk :),/r/UBreddit/comments/j66ajk/just_wanted_to_share_some_pics_ive_taken_from_my/,1,0,0,9,0,,279
64,1612498008.0,False,False,False,False,False,False,t5_2s46r,r/UBreddit,14892,A quick reminder,/r/UBreddit/comments/lcz0aa/a_quick_reminder/,2,0,0,6,0,,280
65,1554990716.0,False,False,False,False,False,False,t5_2s46r,r/UBreddit,14892,walking to class today,/r/UBreddit/comments/bc04nr/walking_to_class_today/,0,0,0,4,0,,277
66,1602683060.0,False,False,False,False,False,False,t5_2s46r,r/UBreddit,14892,since it’s the only good morning messages I’ll ever get,/r/UBreddit/comments/jb0x70/since_its_the_only_good_morning_messages_ill_ever/,0,0,0,11,0,,280
67,1616709954.0,False,False,False,False,False,False,t5_2s46r,r/UBreddit,14892,When a professor posts notes as a word doc instead of pdf and I’ve downloaded the same document 5+ times,/r/UBreddit/comments/md9p9i/when_a_professor_posts_notes_as_a_word_doc/,0,0,0,7,0,,274
68,1600311537.0,False,False,False,False,False,False,t5_2s46r,r/UBreddit,14892,"I have done it, the hunt is on to find which fountain it was. Good luck.",/r/UBreddit/comments/iuayvo/i_have_done_it_the_hunt_is_on_to_find_which/,2,0,0,25,0,,277
69,1631592770.0,False,False,True,False,False,False,t5_2s46r,r/UBreddit,14892,do these people disappear after CSE115,/r/UBreddit/comments/pnvkzw/do_these_people_disappear_after_cse115/,0,0,0,65,1,,275
70,1601304189.0,False,False,False,False,False,False,t5_2s46r,r/UBreddit,14892,Good luck people,/r/UBreddit/comments/j1d9f9/good_luck_people/,0,0,0,9,0,,271
71,1597576880.0,False,False,False,False,False,False,t5_2s46r,r/UBreddit,14892,"To all of you that will be on campus this semester, good luck",/r/UBreddit/comments/iaqpdk/to_all_of_you_that_will_be_on_campus_this/,0,0,0,69,0,,274
72,1618849242.0,False,False,False,False,False,False,t5_2s46r,r/UBreddit,14892,The culmination of four years of t-shirt giveaways,/r/UBreddit/comments/mu494q/the_culmination_of_four_years_of_tshirt_giveaways/,0,0,0,3,0,,274
73,1607903204.0,False,False,False,False,False,False,t5_2s46r,r/UBreddit,14892,WEEK 16!!! FINALS WEEK IS HERE!!!! ONE LAST PUSH AND YOU'LL BE FREE UNTIL FEBRUARY 1ST!!!!! YOU'VE GOT THIS!!!!! MR. KRABS BELIEVES IN YOU!!!! GIVE IT UP FOR WEEK 16!!!!,/r/UBreddit/comments/kclsbs/week_16_finals_week_is_here_one_last_push_and/,1,0,0,12,0,,273
74,1595171145.0,False,False,False,False,False,False,t5_2s46r,r/UBreddit,14892,So I got bored enough to build a section of the South Lake Village apartments in the sims 4 from memory...,/r/UBreddit/comments/hu1www/so_i_got_bored_enough_to_build_a_section_of_the/,0,0,0,15,0,,274
75,1584365960.0,False,False,False,False,False,False,t5_2s46r,r/UBreddit,14892,Applies for zoom in and zoom out too!,/r/UBreddit/comments/fjl3h6/applies_for_zoom_in_and_zoom_out_too/,1,0,0,4,0,,272
76,1582212750.0,False,False,False,False,False,False,t5_2s46r,r/UBreddit,14892,"When I decide to join the discussion and ask something in class and the professor says ""that's a great question actually""",/r/UBreddit/comments/f6uprv/when_i_decide_to_join_the_discussion_and_ask/,0,0,0,8,0,,273
77,1588211761.0,False,False,False,False,False,False,t5_2s46r,r/UBreddit,14892,Empty North Campus from Above,/r/UBreddit/comments/gamqaf/empty_north_campus_from_above/,0,0,0,23,0,,274
78,1571694119.0,False,False,False,False,False,False,t5_2s46r,r/UBreddit,14892,UB when students beg for a day off during the fall semester,/r/UBreddit/comments/dl7gqx/ub_when_students_beg_for_a_day_off_during_the/,0,0,0,8,0,,272
79,1596735609.0,False,False,False,False,False,False,t5_2s46r,r/UBreddit,14892,Y’all ready?,/r/UBreddit/comments/i4wb6a/yall_ready/,0,0,0,9,0,,270
80,1584043154.0,False,False,False,False,False,False,t5_2s46r,r/UBreddit,14892,Hope these guys are my online professors,/r/UBreddit/comments/fhmhrp/hope_these_guys_are_my_online_professors/,0,0,0,4,0,,268
81,1604885738.0,False,False,False,False,False,False,t5_2s46r,r/UBreddit,14892,"WEEK ELEVEN!! THE ELECTION IS FINALLY OVER, THE BILLS WON AND ARE 7-2, THE WEATHER IS BEAUTIFUL, AND THANKSGIVING BREAK IS FAST APPROACHING!!! GET OUTSIDE AND STAY POSITIVE!!! GIVE IT UP FOR WEEK ELEVEN!!!",/r/UBreddit/comments/jqo8yw/week_eleven_the_election_is_finally_over_the/,2,0,0,26,0,,269
82,1564589148.0,False,False,False,False,False,False,t5_2s46r,r/UBreddit,14892,What is up my fellow Bulls? I just finished my schedule for the fall and I was wondering what you guys think of it. Thanks so much!,/r/UBreddit/comments/ckaf70/what_is_up_my_fellow_bulls_i_just_finished_my/,0,0,0,10,0,,268
83,1619615544.0,False,False,False,False,False,False,t5_2s46r,r/UBreddit,14892,The sacred protector of Lockwood has returned,/r/UBreddit/comments/n0ehph/the_sacred_protector_of_lockwood_has_returned/,5,0,0,15,0,,265
84,1601493594.0,False,False,False,False,False,False,t5_2s46r,r/UBreddit,14892,WEEK FIVE!!! THIS POST IS LATE AND LESS CREATIVE DUE TO MIDTERMS CRUSHING MY SANITY!!! DON'T FORGET TO TAKE TIME TO RELAX!!! GIVE IT UP FOR WEEK FIVE!!!!,/r/UBreddit/comments/j2sqyv/week_five_this_post_is_late_and_less_creative_due/,8,0,0,10,0,,267
85,1596507255.0,False,False,False,False,False,False,t5_2s46r,r/UBreddit,14892,UB north campus from a plane,/r/UBreddit/comments/i3assb/ub_north_campus_from_a_plane/,2,0,0,13,0,,268
86,1588991024.0,False,False,False,False,False,False,t5_2s46r,r/UBreddit,14892,Professors during finals week like,/r/UBreddit/comments/gg6z7p/professors_during_finals_week_like/,0,0,0,4,0,,266
87,1633659515.0,False,False,False,False,False,False,t5_2s46r,r/UBreddit,14892,I thought this was a joke...,/r/UBreddit/comments/q3o991/i_thought_this_was_a_joke/,5,0,0,32,0,,264
88,1621166968.0,False,False,False,False,False,False,t5_2s46r,r/UBreddit,14892,"please respect our privacy at this time, thank u",/r/UBreddit/comments/ndmzhq/please_respect_our_privacy_at_this_time_thank_u/,0,0,0,4,0,,265
89,1599324543.0,False,False,False,False,False,False,t5_2s46r,r/UBreddit,14892,Found UB’s testing site,/r/UBreddit/comments/in4eyh/found_ubs_testing_site/,0,0,0,14,0,,262
90,1600355782.0,False,False,False,False,False,False,t5_2s46r,r/UBreddit,14892,Boom,/r/UBreddit/comments/iulgkk/boom/,2,0,0,5,0,,261
91,1620407796.0,False,False,False,False,False,False,t5_2s46r,r/UBreddit,14892,😴,/r/UBreddit/comments/n73ome/_/,2,0,0,11,0,,258
92,1618549605.0,False,False,False,False,False,False,t5_2s46r,r/UBreddit,14892,UB students after doing their 13 week straight without a break,/r/UBreddit/comments/mrwbu1/ub_students_after_doing_their_13_week_straight/,5,0,0,6,0,,261
93,1605722234.0,False,False,False,False,False,False,t5_2s46r,r/UBreddit,14892,Hang in there folks,/r/UBreddit/comments/jwkmil/hang_in_there_folks/,0,0,0,8,0,,260
94,1521172264.0,False,True,False,False,False,False,t5_2s46r,r/UBreddit,14892,UB 89-68 Arizona Upvote Party,/r/UBreddit/comments/84snn8/ub_8968_arizona_upvote_party/,0,0,0,33,0,,263
95,1617914055.0,False,False,False,False,False,False,t5_2s46r,r/UBreddit,14892,POV: Me opening a math exam on a 32” gaming monitor,/r/UBreddit/comments/mn0ux4/pov_me_opening_a_math_exam_on_a_32_gaming_monitor/,1,0,0,10,0,,261
96,1615556624.0,False,False,False,False,False,False,t5_2s46r,r/UBreddit,14892,Feels terrible for those of you who began college last year,/r/UBreddit/comments/m3ht6s/feels_terrible_for_those_of_you_who_began_college/,3,0,0,17,0,,258
97,1585012428.0,False,False,False,False,False,False,t5_2s46r,r/UBreddit,14892,Stönks,/r/UBreddit/comments/fnw3fd/stönks/,0,0,0,16,0,,260
98,1584027115.0,False,False,False,False,False,False,t5_2s46r,r/UBreddit,14892,Class of 2020 be like:,/r/UBreddit/comments/fhi496/class_of_2020_be_like/,0,0,0,5,0,,261
99,1606242153.0,False,False,False,False,False,False,t5_2s46r,r/UBreddit,14892,"Ub asking for donations after not letting us go pass fail, charging us more for online tuition and dorming, putting us under crippling debt and stress, and overall viewing us and paychecks and money signs instead of students.",/r/UBreddit/comments/k0aj4e/ub_asking_for_donations_after_not_letting_us_go/,3,0,0,14,0,,254
100,1584737211.0,False,False,False,False,False,False,t5_2s46r,r/UBreddit,14892,The bull outside the SU today,/r/UBreddit/comments/fm2fmi/the_bull_outside_the_su_today/,0,0,0,6,0,,255
101,1575841609.0,False,False,False,False,False,False,t5_2s46r,r/UBreddit,14892,Studying's going well.. or something like that,/r/UBreddit/comments/e801eq/studyings_going_well_or_something_like_that/,0,0,0,4,0,,256
102,1568748198.0,False,False,False,False,False,False,t5_2s46r,r/UBreddit,14892,"The Man, the myth, the legend",/r/UBreddit/comments/d5ltgz/the_man_the_myth_the_legend/,0,0,0,17,0,,258
103,1575986005.0,False,False,False,False,False,False,t5_2s46r,r/UBreddit,14892,I believe in you and so does my cat,/r/UBreddit/comments/e8qvdh/i_believe_in_you_and_so_does_my_cat/,0,0,0,17,0,,254
104,1587005557.0,False,False,False,False,False,False,t5_2s46r,r/UBreddit,14892,Pour one out for my GPA lads,/r/UBreddit/comments/g26o64/pour_one_out_for_my_gpa_lads/,1,0,0,1,0,,255
105,1604083938.0,False,False,False,False,False,False,t5_2s46r,r/UBreddit,14892,It’s cold,/r/UBreddit/comments/jl2rdr/its_cold/,1,0,0,9,0,,255
106,1618589512.0,False,False,False,False,False,False,t5_2s46r,r/UBreddit,14892,This is how it's done 👑,/r/UBreddit/comments/ms6hr1/this_is_how_its_done/,1,0,0,15,0,,253
107,1609776495.0,False,False,False,False,False,False,t5_2s46r,r/UBreddit,14892,"PLEASE pay attention: HOT, SEXY internships in your area (REAL!) (21+)",/r/UBreddit/comments/kqbo4s/please_pay_attention_hot_sexy_internships_in_your/,4,0,0,5,1,,250
108,1597712936.0,False,False,False,False,False,False,t5_2s46r,r/UBreddit,14892,First duo and now this!,/r/UBreddit/comments/ibr7f1/first_duo_and_now_this/,3,0,0,15,0,,250
109,1633967666.0,False,False,False,False,False,False,t5_2s46r,r/UBreddit,14892,WEEK 7!!!!!!! UB NOW OBSERVES INDIGENOUS PEOPLES DAY BUT WE STILL DONT GET OFF FOR IT!!! EVERYBODY GIVE IT UP FOR WEEK 7!!!!!!!,/r/UBreddit/comments/q5ywht/week_7_ub_now_observes_indigenous_peoples_day_but/,2,0,0,6,0,,249
110,1602785437.0,False,False,False,False,False,False,t5_2s46r,r/UBreddit,14892,pinky promise?,/r/UBreddit/comments/jbsx6y/pinky_promise/,1,0,0,15,0,,250
111,1633538850.0,False,False,False,False,False,False,t5_2s46r,r/UBreddit,14892,Y’all stealing microwaves in broad daylight 😭,/r/UBreddit/comments/q2odij/yall_stealing_microwaves_in_broad_daylight/,0,0,0,58,0,,246
112,1583651981.0,False,False,False,False,False,False,t5_2s46r,r/UBreddit,14892,This is a personal attack,/r/UBreddit/comments/ff97fw/this_is_a_personal_attack/,0,0,0,6,0,,246
113,1576120407.0,False,True,False,False,False,False,t5_2s46r,r/UBreddit,14892,To anyone who needs to hear it...,/r/UBreddit/comments/e9hxk4/to_anyone_who_needs_to_hear_it/,1,0,0,26,0,,251
114,1604514294.0,False,False,False,False,False,False,t5_2s46r,r/UBreddit,14892,Just thought it was appropriate to share to y’all,/r/UBreddit/comments/jo1xzh/just_thought_it_was_appropriate_to_share_to_yall/,0,0,0,7,0,,246
115,1603146278.0,False,False,False,False,False,False,t5_2s46r,r/UBreddit,14892,Does this happen to anyone else?,/r/UBreddit/comments/jecdg7/does_this_happen_to_anyone_else/,1,0,0,9,0,,246
116,1570582829.0,False,False,False,False,False,False,t5_2s46r,r/UBreddit,14892,Quick edit I did after Chemistry homework almost killed me,/r/UBreddit/comments/df9ki8/quick_edit_i_did_after_chemistry_homework_almost/,0,0,0,17,0,,247
117,1614000946.0,False,False,False,False,False,False,t5_2s46r,r/UBreddit,14892,Putting some motivation in your Monday,/r/UBreddit/comments/lpo4m7/putting_some_motivation_in_your_monday/,0,0,0,7,0,,246
118,1600105055.0,False,False,False,False,False,False,t5_2s46r,r/UBreddit,14892,Semester so far,/r/UBreddit/comments/ispr04/semester_so_far/,2,0,0,6,0,,244
119,1599087988.0,False,False,False,False,False,False,t5_2s46r,r/UBreddit,14892,Close enough,/r/UBreddit/comments/ilhrrc/close_enough/,2,0,0,14,0,,246
120,1568396569.0,False,False,False,False,False,False,t5_2s46r,r/UBreddit,14892,the virgin class goer vs The Chad Boomboxer,/r/UBreddit/comments/d3st73/the_virgin_class_goer_vs_the_chad_boomboxer/,0,0,0,22,0,,247
121,1555275701.0,False,False,False,False,False,False,t5_2s46r,r/UBreddit,14892,Really starting to run out of material,/r/UBreddit/comments/bd7jvq/really_starting_to_run_out_of_material/,0,0,0,22,0,,243
122,1609203021.0,False,False,False,False,False,False,t5_2s46r,r/UBreddit,14892,You get a pdf and you get a pdf,/r/UBreddit/comments/km39b4/you_get_a_pdf_and_you_get_a_pdf/,0,0,0,6,0,,245
123,1570814329.0,False,False,False,False,False,False,t5_2s46r,r/UBreddit,14892,UBIT! Open Up!,/r/UBreddit/comments/dgi9k7/ubit_open_up/,0,0,0,2,0,,246
124,1606511262.0,False,False,False,False,False,False,t5_2s46r,r/UBreddit,14892,Teachers giving homework during thanksgiving 😍,/r/UBreddit/comments/k29p8f/teachers_giving_homework_during_thanksgiving/,1,0,0,7,0,,245
