,created_utc,is_crosspostable,is_self,is_video,locked,media_only,over_18,subreddit_id,subreddit_name_prefixed,subreddit_subscribers,title,permalink,total_awards_received,downs,gilded,num_comments,num_crossposts,num_reports,ups
985,1632482120.0,False,False,False,False,False,False,t5_2s46r,r/UBreddit,14892,Me daily walking around campus due to the fact so many of these students are buff for no reason 😭 let’s discuss,/r/UBreddit/comments/puhlhn/me_daily_walking_around_campus_due_to_the_fact_so/,0,0,0,37,0,,116
986,1631565272.0,False,False,False,False,False,False,t5_2s46r,r/UBreddit,14892,WEEK 3!!! I TOTALLY DIDNT FORGET THAT IM POSTING THESE AGAIN BUT THAT RAIN LAST NIGHT THO!!! EVERYBODY GIVE IT UP FOR WEEK 3!!!,/r/UBreddit/comments/pnntj4/week_3_i_totally_didnt_forget_that_im_posting/,0,0,0,5,0,,117
987,1630519152.0,False,True,False,False,False,False,t5_2s46r,r/UBreddit,14892,This wifi man,/r/UBreddit/comments/pfzbc0/this_wifi_man/,0,0,0,33,0,,116
988,1619878004.0,False,False,False,False,False,False,t5_2s46r,r/UBreddit,14892,MISSING: Goldfish Last seen in C3. Responds to Goldie very friendly.,/r/UBreddit/comments/n2j0hz/missing_goldfish_last_seen_in_c3_responds_to/,1,0,0,7,0,,118
989,1616950633.0,False,False,True,False,False,False,t5_2s46r,r/UBreddit,14892,The Geese Chronicles: “time to wake up hoomans at 8 am and terrorize them”,/r/UBreddit/comments/mf4sdn/the_geese_chronicles_time_to_wake_up_hoomans_at_8/,0,0,0,20,0,,115
990,1599364648.0,False,True,False,False,False,False,t5_2s46r,r/UBreddit,14892,"All things considered, this semester is going pretty well.",/r/UBreddit/comments/infd6b/all_things_considered_this_semester_is_going/,1,0,0,16,0,,118
991,1598833792.0,False,False,False,False,False,False,t5_2s46r,r/UBreddit,14892,What a way to spend a Sunday,/r/UBreddit/comments/ijnzj9/what_a_way_to_spend_a_sunday/,0,0,0,7,0,,115
992,1587360327.0,False,True,False,False,False,False,t5_2s46r,r/UBreddit,14892,To all the people wondering wtf happened with the physics test,/r/UBreddit/comments/g4mvs5/to_all_the_people_wondering_wtf_happened_with_the/,0,0,0,23,0,,116
993,1580255806.0,False,False,False,False,False,False,t5_2s46r,r/UBreddit,14892,Was doing some reconnaissance :P,/r/UBreddit/comments/eve88p/was_doing_some_reconnaissance_p/,0,0,0,7,0,,115
994,1579298699.0,False,False,False,False,False,False,t5_2s46r,r/UBreddit,14892,"Lo and behold, the computers and printing station on the 2nd Floor at Silverman",/r/UBreddit/comments/eq7aum/lo_and_behold_the_computers_and_printing_station/,0,0,0,22,0,,116
995,1570942138.0,False,False,False,False,False,False,t5_2s46r,r/UBreddit,14892,Spidey pulled up 👀,/r/UBreddit/comments/dh64u1/spidey_pulled_up/,0,0,0,7,0,,117
996,1544128209.0,False,False,True,False,False,False,t5_2s46r,r/UBreddit,14892,Short time lapse from Capen this morning,/r/UBreddit/comments/a3rxr4/short_time_lapse_from_capen_this_morning/,0,0,0,1,0,,119
997,1635549894.0,False,False,False,False,False,False,t5_2s46r,r/UBreddit,14892,In memory of the one person that asked you how you were doing today,/r/UBreddit/comments/qip03v/in_memory_of_the_one_person_that_asked_you_how/,1,0,0,5,0,,113
998,1623690847.0,False,False,False,False,False,False,t5_2s46r,r/UBreddit,14892,CSE in a nutshell,/r/UBreddit/comments/nzrr4h/cse_in_a_nutshell/,1,0,0,7,0,,117
999,1619182087.0,False,False,True,False,False,False,t5_2s46r,r/UBreddit,14892,New daily health check has been out for a while now. Decided to do a throwback and speedrun it.,/r/UBreddit/comments/mwuhe1/new_daily_health_check_has_been_out_for_a_while/,0,0,0,5,0,,115
1000,1521000374.0,False,True,False,False,False,False,t5_mouw,r/science,27112670,Physicist Stephen Hawking dies aged 76,/r/science/comments/84aiy6/physicist_stephen_hawking_dies_aged_76/,21,0,4,3861,14,,199296
1001,1554901897.0,False,False,False,False,False,False,t5_mouw,r/science,27112670,The first picture of a black hole opens a new era of astrophysics. The supermassive beast lies in a galaxy called M87 more than 50 million light-years away,/r/science/comments/bblu6v/the_first_picture_of_a_black_hole_opens_a_new_era/,34,0,8,5552,48,,155297
1002,1532038912.0,False,False,False,False,False,False,t5_mouw,r/science,27112670,"Since legalizing cannabis in 2012, crime clearance rates are increasing faster in Washington and Colorado than the rest of country, suggesting that legalization may free police to focus on more serious crimes.",/r/science/comments/90adse/since_legalizing_cannabis_in_2012_crime_clearance/,5,0,2,4767,29,,124688
1003,1511108647.0,False,True,False,False,False,False,t5_mouw,r/science,27112670,Raising the taxes of graduate students by as much as 300% will be a disaster for the USA,/r/science/comments/7e1jo1/raising_the_taxes_of_graduate_students_by_as_much/,7,0,7,10948,7,,124371
1004,1516633319.0,False,False,False,False,False,False,t5_mouw,r/science,27112670,No evidence to support link between violent video games and behaviour - Researchers at the University of York have found no evidence to support the theory that video games make players more violent.,/r/science/comments/7s6a9z/no_evidence_to_support_link_between_violent_video/,4,0,2,3798,16,,114562
1005,1607978957.0,False,False,False,False,False,False,t5_mouw,r/science,27112670,"LED lights found to kill coronavirus efficiently, quickly, and cheaply, a global first in fight against COVID-19. The finding suggests the UV-LEDs can be installed in air conditioning and water systems. It requires less than half a minute to destroy more than 99.9% of coronaviruses.",/r/science/comments/kd67rx/led_lights_found_to_kill_coronavirus_efficiently/,312,0,0,3548,37,,114428
1006,1612211502.0,False,False,False,True,False,False,t5_mouw,r/science,27112670,"Wealthy, successful people from privileged backgrounds often misrepresent their origins as working-class in order to tell a ‘rags to riches’ story resulting from hard work and perseverance, rather than social position and intergenerational wealth.",/r/science/comments/lad9pe/wealthy_successful_people_from_privileged/,109,0,1,3177,46,,113727
1007,1512055388.0,False,False,False,False,False,False,t5_mouw,r/science,27112670,New study finds that most redditors don’t actually read the articles they vote on.,/r/science/comments/7gn1ne/new_study_finds_that_most_redditors_dont_actually/,2,0,0,4560,5,,110991
1008,1614780956.0,False,False,False,False,False,False,t5_mouw,r/science,27112670,"Casual sex among young adults has declined due to decline in drinking, an increase in computer gaming, and more young adults living with their parents.",/r/science/comments/lwuvpc/casual_sex_among_young_adults_has_declined_due_to/,212,0,0,9599,24,,110667
1009,1570448099.0,False,False,False,False,False,False,t5_mouw,r/science,27112670,"Scientists believe that the function of zebras' stripes are to deter insects, so a team of researchers painted black and white stripes on cows. They found that it reduced the number of biting flies landing on the cows by more than 50%.",/r/science/comments/dei73a/scientists_believe_that_the_function_of_zebras/,3,0,0,2038,45,,109324
1010,1606428305.0,False,False,False,False,False,False,t5_mouw,r/science,27112670,"In the US, states typically pay for prison while counties determine sentencing. A natural experiment whereby the cost burden of juvenile incarceration was placed on counties led to a stark drop in incarceration. This suggests that mass incarceration in the US is in part due to misaligned incentives.",/r/science/comments/k1ofcu/in_the_us_states_typically_pay_for_prison_while/,63,0,0,1827,25,,106099
1011,1611228462.0,False,False,False,False,False,False,t5_mouw,r/science,27112670,"Korean scientists developed a technique for diagnosing prostate cancer from urine within only 20 minutes with almost 100% accuracy, using AI and a biosensor, without the need for an invasive biopsy. It may be further utilized in the precise diagnoses of other cancers using a urine test.",/r/science/comments/l1work/korean_scientists_developed_a_technique_for/,222,0,1,1150,33,,104795
1012,1566128489.0,False,False,False,False,False,False,t5_mouw,r/science,27112670,"Having kids makes you happier, but only when they move out, according to a new study, which suggests that parents are happier than non-parents later in life, when their children move out and become sources of social enjoyment rather than stress (n=55,000).",/r/science/comments/cs072c/having_kids_makes_you_happier_but_only_when_they/,0,0,0,4026,18,,104595
1013,1619178214.0,False,False,False,False,False,False,t5_mouw,r/science,27112670,"Scientists find new evidence linking essential oils to seizures: Analyzing 350 seizure cases, researchers found that 15.7% of seizures may have been induced by inhalation, ingestion or topical use of essential oils. After stopping use of oils, the vast majority did not experience another seizure.",/r/science/comments/mwtdiq/scientists_find_new_evidence_linking_essential/,106,0,0,3664,41,,104437
1014,1553774691.0,False,False,False,False,False,False,t5_mouw,r/science,27112670,"Woman with ‘mutant’ gene who feels no pain and heals without scarring discovered by scientists. She reported numerous burns and cuts without pain, often smelling her burning flesh before noticing any injury, as published in the British Journal of Anaesthesia, and could open door to new treatments.",/r/science/comments/b6hy7e/woman_with_mutant_gene_who_feels_no_pain_and/,19,0,6,3231,43,,101696
1015,1590228581.0,False,False,False,False,False,False,t5_mouw,r/science,27112670,"The first human trial of a COVID-19 vaccine finds that it is safe, well-tolerated, and induces a rapid immune response: “These results represent an important milestone.”",/r/science/comments/gp2hdt/the_first_human_trial_of_a_covid19_vaccine_finds/,21,0,3,2390,26,,97581
1016,1572778018.0,False,False,False,False,False,False,t5_mouw,r/science,27112670,"Scientists replaced 40 percent of cement with rice husk cinder, limestone crushing waste, and silica sand, giving concrete a rubber-like quality, six to nine times more crack-resistant than regular concrete. It self-seals, replaces cement with plentiful waste products, and should be cheaper to use.",/r/science/comments/dqysmm/scientists_replaced_40_percent_of_cement_with/,2,0,1,1631,26,,97225
1017,1581772506.0,False,False,False,False,False,False,t5_mouw,r/science,27112670,"A new study in The Lancet by a team of Yale epidemiologists finds that Medicare for All would save more than 68,000 lives annually as well as $450 billion in cost",/r/science/comments/f4998k/a_new_study_in_the_lancet_by_a_team_of_yale/,23,0,3,5444,62,,94805
1018,1551737423.0,False,False,False,False,False,False,t5_mouw,r/science,27112670,"MMR vaccine does not cause autism, another study confirms",/r/science/comments/axd4l4/mmr_vaccine_does_not_cause_autism_another_study/,5,0,1,2562,27,,94092
1019,1611512655.0,False,False,False,False,False,False,t5_mouw,r/science,27112670,A quarter of all known bee species haven't been seen since the 1990s,/r/science/comments/l44tdt/a_quarter_of_all_known_bee_species_havent_been/,176,0,1,1703,27,,93407
1020,1564104353.0,False,False,False,False,False,False,t5_mouw,r/science,27112670,"Tree stumps that should be dead can be kept alive by nearby trees, discovers new study, which found a tree stump that should have died is being kept alive by neighbouring trees through an interconnected root system, which may change our view from trees as individuals to forests as ‘superorganisms’.",/r/science/comments/chwg8s/tree_stumps_that_should_be_dead_can_be_kept_alive/,6,0,1,1917,52,,92358
1021,1601002070.0,False,False,False,False,False,False,t5_mouw,r/science,27112670,"Research finds that crows know what they know and can ponder the content of their own minds, a manifestation of higher intelligence and analytical thought long believed the sole province of humans and a few other higher mammals.",/r/science/comments/izbj3r/research_finds_that_crows_know_what_they_know_and/,242,0,1,2848,58,,91852
1022,1509136059.0,False,False,False,False,False,False,t5_mouw,r/science,27112670,"Healthy obesity doesn’t exist; obesity is not a benign condition - new study, published in the Journal of the American College of Cardiology, show.",/r/science/comments/795tpr/healthy_obesity_doesnt_exist_obesity_is_not_a/,2,0,1,6125,1,,91800
1023,1598961372.0,False,False,False,False,False,False,t5_mouw,r/science,27112670,"Venom from honeybees has been found to rapidly kill aggressive and hard-to-treat breast cancer cells, finds new Australian research. The study also found when the venom's main component was combined with existing chemotherapy drugs, it was extremely efficient at reducing tumour growth in mice.",/r/science/comments/ikivxq/venom_from_honeybees_has_been_found_to_rapidly/,133,0,1,1492,15,,91518
1024,1579024189.0,False,False,False,False,False,False,t5_mouw,r/science,27112670,"Marijuana use among college students has been trending upward for years, but in states that have legalized recreational marijuana, use has jumped even higher. After legalization, however, students showed a greater drop in binge drinking than their peers in states where marijuana is not legal.",/r/science/comments/eoomwz/marijuana_use_among_college_students_has_been/,6,0,0,3413,22,,90865
1025,1610059079.0,False,False,False,False,False,False,t5_mouw,r/science,27112670,"US states that rely on private prisons incarcerate more people for longer periods of time, according to a first-of-its-kind study that establishes a causal connection between private prisons and incarceration.",/r/science/comments/ksoppp/us_states_that_rely_on_private_prisons/,37,0,3,1744,27,,90648
1026,1598395217.0,False,False,False,False,False,False,t5_mouw,r/science,27112670,Bird deaths down 70 percent after painting wind turbine blades,/r/science/comments/igmtvw/bird_deaths_down_70_percent_after_painting_wind/,156,0,0,2153,24,,90614
1027,1631139293.0,False,False,False,False,False,False,t5_mouw,r/science,27112670,mRNA cancer therapy now in human trials after shrinking mouse tumours,/r/science/comments/pkkhqa/mrna_cancer_therapy_now_in_human_trials_after/,316,0,3,2890,17,,90523
1028,1604664072.0,False,False,False,False,False,False,t5_mouw,r/science,27112670,"The first severe COVID-19 patient successfully treated with human recombinant soluble ACE2 (hrsACE2), with disappearance of coronavirus swiftly from the serum, nasal cavity and lungs, and a reduction of inflammatory cytokine levels, leading to a significant clinical improvement.",/r/science/comments/jp3w7w/the_first_severe_covid19_patient_successfully/,164,0,2,1437,24,,89760
1029,1544643515.0,False,False,False,False,False,False,t5_mouw,r/science,27112670,"In Seattle, Washington, delaying the start time of two high schools by nearly an hour lengthened students' daily sleep by more than half an hour, and was associated with reduced sleepiness and increased academic performance.",/r/science/comments/a5li71/in_seattle_washington_delaying_the_start_time_of/,4,0,2,2826,7,,89336
1030,1605954071.0,False,False,False,False,False,False,t5_mouw,r/science,27112670,"Testing half the population weekly with inexpensive, rapid COVID-19 tests would drive the virus toward elimination within weeks, even if the tests are less sensitive than gold-standard. This could lead to “personalized stay-at-home orders” without shutting down restaurants, bars, retail and schools.",/r/science/comments/jy8knh/testing_half_the_population_weekly_with/,47,0,1,3466,14,,89238
1031,1549027777.0,False,False,False,False,False,False,t5_mouw,r/science,27112670,"Self-driving cars will ""cruise"" to avoid paying to park, suggests a new study based on game theory, which found that even when you factor in electricity, depreciation, wear and tear, and maintenance, cruising costs about 50 cents an hour, which is still cheaper than parking even in a small town.",/r/science/comments/am2056/selfdriving_cars_will_cruise_to_avoid_paying_to/,1,0,0,6324,18,,89217
1032,1546897129.0,False,False,False,False,False,False,t5_mouw,r/science,27112670,"The United States, on a per capita basis, spends much more on health care than other developed countries; the chief reason is not greater health care utilization, but higher prices, according to a new study from Johns Hopkins.",/r/science/comments/admli1/the_united_states_on_a_per_capita_basis_spends/,3,0,1,5284,26,,89153
1033,1589660574.0,False,False,False,False,False,False,t5_mouw,r/science,27112670,"U.S. adults look to scientific organizations like the Centers for Disease Control and Prevention, rather than their president, to lead the country’s response to the coronavirus pandemic",/r/science/comments/gl1nvf/us_adults_look_to_scientific_organizations_like/,3,0,1,3274,11,,89048
1034,1617810359.0,False,False,False,False,False,False,t5_mouw,r/science,27112670,"Two thirds of New Zealanders believed there were ‘silver linings’ to the country’s COVID-19 lockdown last year, positive experiences such as pride in the country’s response, more free time to exercise and take up hobbies, flexibility working from home, and reduced time spent commuting.",/r/science/comments/mm50xh/two_thirds_of_new_zealanders_believed_there_were/,69,0,0,2542,12,,88577
1035,1606572183.0,False,False,False,False,False,False,t5_mouw,r/science,27112670,Sleep deprivation impairs the suppression of unwanted thoughts and memories which enter conscious awareness when individuals confront reminders. Sleep-deprived people experienced significantly more intrusions and unsuccessful suppressions of unwanted thoughts.,/r/science/comments/k2o5a8/sleep_deprivation_impairs_the_suppression_of/,259,0,0,1888,45,,88046
1036,1493238165.0,False,False,False,False,False,False,t5_mouw,r/science,27112670,"Paleontologists have dug up a 130,000-year-old mastodon skeleton that looks like it was butchered by humans. But they found it in America, where people were not supposed to have arrived for another 100,000 years. Findings could upend our understanding of human history.",/r/science/comments/67qs7r/paleontologists_have_dug_up_a_130000yearold/,0,0,0,3559,0,,87275
1037,1608328598.0,False,False,False,False,False,False,t5_mouw,r/science,27112670,"Women overestimate men's attraction to thin female fashion models, study finds",/r/science/comments/kfulot/women_overestimate_mens_attraction_to_thin_female/,96,0,0,5939,15,,87245
1038,1608892626.0,False,False,False,False,False,False,t5_mouw,r/science,27112670,"5- to 9-year-old children chose to save multiple dogs over 1 human, and valued the life of a dog as much as a human. By contrast, almost all adults chose to save 1 human over even 100 dogs. The view that humans are morally more important than animals appears later and may be socially acquired.",/r/science/comments/kjx2kk/5_to_9yearold_children_chose_to_save_multiple/,54,0,1,5138,26,,86781
1039,1603728183.0,False,False,False,False,False,False,t5_mouw,r/science,27112670,"Water has been definitively found on the Moon, Nasa has said",/r/science/comments/jih87f/water_has_been_definitively_found_on_the_moon/,130,0,0,1549,21,,86119
1040,1559860113.0,False,False,False,False,False,False,t5_mouw,r/science,27112670,"Industrial methane emissions are 100 times higher than reported, and have been vastly underestimated, finds a new study using a Google Street View car equipped with a high-precision methane sensor. They also were substantially higher than the EPA estimate for all industrial processes in the US.",/r/science/comments/bxmxri/industrial_methane_emissions_are_100_times_higher/,19,0,6,2906,33,,85485
1041,1635439879.0,False,False,False,False,False,False,t5_mouw,r/science,27112670,"Study: When given cash with no strings attached, low- and middle-income parents increased their spending on their children. The findings contradict a common argument in the U.S. that poor parents cannot be trusted to receive cash to use however they want.",/r/science/comments/qhr9r1/study_when_given_cash_with_no_strings_attached/,123,0,0,3295,37,,84865
1042,1580817894.0,False,False,False,False,False,False,t5_mouw,r/science,27112670,"Babies, even when hungry, are willing to give a tasty snack to a stranger in need, new study shows. The findings demonstrate that altruism (the act of giving away something desirable, even at a cost to oneself) begins in infancy and suggest that early social experiences can shape altruism.",/r/science/comments/eyp2nd/babies_even_when_hungry_are_willing_to_give_a/,3,0,0,1117,27,,84788
1043,1602236376.0,False,False,False,False,False,False,t5_mouw,r/science,27112670,Human 'microevolution' sees more people born without wisdom teeth and an extra artery,/r/science/comments/j7w01e/human_microevolution_sees_more_people_born/,129,0,0,4417,25,,84775
1044,1532381748.0,False,False,False,False,False,False,t5_mouw,r/science,27112670,"Children as young as age 4 express dislike of and are willing to punish those who freeload off the work of other group members, a new study has found. But kids also make a clear distinction between those who freeload intentionally and those who have good reasons why they can’t contribute.",/r/science/comments/91b8gd/children_as_young_as_age_4_express_dislike_of_and/,0,0,0,1812,13,,84004
1045,1487786409.0,False,False,False,False,False,False,t5_mouw,r/science,27112670,Seven Earth-sized planets found orbiting an ultracool dwarf star are strong candidates in the search for life outside our solar system.,/r/science/comments/5vk7pv/seven_earthsized_planets_found_orbiting_an/,2,0,1,2852,0,,83678
1046,1556560568.0,False,False,False,False,False,False,t5_mouw,r/science,27112670,"The Netflix show ""13 Reasons Why"" was associated with a 28.9% increase in suicide rates among U.S. youth ages 10-17 in the month (April 2017) following the shows release, after accounting for ongoing trends in suicide rates, according to a study.",/r/science/comments/bisiq5/the_netflix_show_13_reasons_why_was_associated/,3,0,2,4660,33,,83633
1047,1607424447.0,False,False,False,False,False,False,t5_mouw,r/science,27112670,"In 2017, the Trump Administration restored local law enforcement access to military weapons and surplus military equipment that had been prohibited by the Obama Administration. New research shows that this militarization of local law enforcement does not actually reduce crime.",/r/science/comments/k92522/in_2017_the_trump_administration_restored_local/,66,0,1,3823,21,,83064
1048,1590186975.0,False,False,False,False,False,False,t5_mouw,r/science,27112670,"Every dollar spent on high-quality, early-childhood programs for disadvantaged children returned $7.3 over the long-term. The programs lead to reductions in taxpayer costs associated with crime, unemployment and healthcare, as well as contribute to a better-prepared workforce.",/r/science/comments/gotf27/every_dollar_spent_on_highquality_earlychildhood/,12,0,1,1698,40,,82981
1049,1563589855.0,False,False,False,False,False,False,t5_mouw,r/science,27112670,Cigarette butts are the most common form of litter on the planet: 4.5 trillion are littered each year. New research shows that they severely impact plant growth. The presence of cigarette butts reduced root biomass by 57%; germination success by 27%; and shoot length by 28%.,/r/science/comments/cfgou9/cigarette_butts_are_the_most_common_form_of/,5,0,3,3125,39,,82562
1050,1619350607.0,False,False,False,False,False,False,t5_mouw,r/science,27112670,"Rising income inequality is not an inevitable outcome of technological progress, but rather the result of policy decisions to weaken unions and dismantle social safety nets, suggests a new study of 14 high-income countries, including Australia, France, Germany, Japan, UK and the US.",/r/science/comments/my6jo7/rising_income_inequality_is_not_an_inevitable/,125,0,0,3108,37,,82252
1051,1604615080.0,False,False,False,False,False,False,t5_mouw,r/science,27112670,"The ""natural experiment"" caused by the shutdown of schools due to the COVID-19 pandemic led to a 2-h shift in the sleep of developing adolescents, longer sleep duration, improved sleep quality, and less daytime sleepiness compared to those experienced under the regular school-time schedule",/r/science/comments/josjux/the_natural_experiment_caused_by_the_shutdown_of/,50,0,1,1977,11,,82017
1052,1514499314.0,False,False,False,False,False,False,t5_mouw,r/science,27112670,Students whose sex ed programs teach abstinence as the only way to protect sexual health have less favorable attitudes toward condoms and are more likely to have unprotected sex than students who learn safe sexual practices. Abstinence-only sex education programs do not stop minors from having sex.,/r/science/comments/7mpvn7/students_whose_sex_ed_programs_teach_abstinence/,0,0,0,3220,1,,81998
1053,1557795828.0,False,False,False,False,False,False,t5_mouw,r/science,27112670,"Store-bought tomatoes taste bland, and scientists have discovered a gene that gives tomatoes their flavor is actually missing in about 93 percent of modern, domesticated varieties. The discovery may help bring flavor back to tomatoes you can pick up in the produce section.",/r/science/comments/boc0z4/storebought_tomatoes_taste_bland_and_scientists/,2,0,0,2800,23,,81860
1054,1576510809.0,False,False,False,False,False,False,t5_mouw,r/science,27112670,Large U.S. study finds that marijuana laws (both recreational & medical) appear to significantly reduce prescription opioid use.,/r/science/comments/ebgos3/large_us_study_finds_that_marijuana_laws_both/,6,0,2,2029,26,,80874
1055,1602796896.0,False,True,False,False,False,False,t5_mouw,r/science,27112670,[Megathread] World's most prestigious scientific publications issue unprecedented critiques of the Trump administration,/r/science/comments/jbwlhh/megathread_worlds_most_prestigious_scientific/,214,0,3,4492,23,,80110
