,created_utc,is_crosspostable,is_self,is_video,locked,media_only,over_18,subreddit_id,subreddit_name_prefixed,subreddit_subscribers,title,permalink,total_awards_received,downs,gilded,num_comments,num_crossposts,num_reports,ups
1497,1543876392.0,False,False,False,False,False,False,t5_mouw,r/science,27112671,"Study finds bad bosses could turn you into a great boss - When offered leadership opportunities, prior victims of workplace abuse are more likely to treat their own subordinates better by learning from the bad behavior of their bosses.",/r/science/comments/a2tyd6/study_finds_bad_bosses_could_turn_you_into_a/,0,0,0,996,7,,51864
1498,1633523098.0,False,False,False,False,False,False,t5_mouw,r/science,27112671,"A study of 1,035 mothers estranged from their adult children found that nearly 80% believed that an ex-husband or their son- or daughter-in-law had turned their children against them.",/r/science/comments/q2jckp/a_study_of_1035_mothers_estranged_from_their/,38,0,0,3743,24,,51835
1499,1625248297.0,False,False,False,False,False,False,t5_mouw,r/science,27112671,"Study finds that microbes in the cow’s gut can break down three types of plastic, serving as a sustainable method of recycling plastic waste.",/r/science/comments/ocfcup/study_finds_that_microbes_in_the_cows_gut_can/,80,0,0,1732,17,,51833
1500,1595006440.0,False,False,False,False,False,False,t5_mouw,r/science,27112673,"About 13% of people are pathological liars, telling an average of 10 lies per day",/r/science/comments/hszrpy/about_13_of_people_are_pathological_liars_telling/,0,0,0,2196,9,,51778
1501,1559906249.0,False,False,False,False,False,False,t5_mouw,r/science,27112673,"Not sticking to a regular bedtime and wake schedule, and different amounts of sleep each night, may lead to a higher risk for high cholesterol, hypertension and high blood sugar. Every hour of variability in time to bed and time asleep may be linked to a 27% greater chance of metabolic abnormality.",/r/science/comments/bxte1h/not_sticking_to_a_regular_bedtime_and_wake/,1,0,0,2008,20,,51755
1502,1518369140.0,False,False,False,False,False,False,t5_mouw,r/science,27112673,"After six months of treatment with medical cannabis, over 14 percent of elderly patients stopped using opioids altogether, while another 3.7 percent were able to reduce their dosage of opiates.",/r/science/comments/7wtzme/after_six_months_of_treatment_with_medical/,0,0,0,1455,7,,51749
1503,1604317458.0,False,False,False,False,False,False,t5_mouw,r/science,27112673,"Wearing a 3-layer nonmedical face mask was not associated with a decline in oxygen saturation in older participants. The pooled mean Spo2 was 96.1% before, 96.5% while, and 96.3% after wearing the mask.",/r/science/comments/jmlyyw/wearing_a_3layer_nonmedical_face_mask_was_not/,59,0,1,2107,11,,51677
1504,1609762306.0,False,False,False,False,False,False,t5_mouw,r/science,27112673,Young children aged 4 and 6 who have experienced compassionate parenting are more generous to others than their peers. Mothers who express compassionate love and empathy provide an early example of prosocial orientation toward the needs of others.,/r/science/comments/kq7jqo/young_children_aged_4_and_6_who_have_experienced/,53,0,1,802,10,,51621
1505,1622108505.0,False,False,False,False,False,False,t5_mouw,r/science,27112673,"'Brain fog' can linger with long-haul COVID-19. At the six-month mark, COVID long-haulers reported worse neurocognitive symptoms than at the outset of their illness. This including trouble forming words, difficulty focusing and absent-mindedness.",/r/science/comments/nm3scn/brain_fog_can_linger_with_longhaul_covid19_at_the/,45,0,0,2900,22,,51597
1506,1543667633.0,False,False,False,False,False,False,t5_mouw,r/science,27112673,"Parents who force unremorseful kids to apologize to others before they’re truly sorry may do more harm than good, suggests a new study. That’s because the point main point of an apology is lost as children may dislike the apologizer even more after the insincere apology than before.",/r/science/comments/a22ox5/parents_who_force_unremorseful_kids_to_apologize/,0,0,0,1506,10,,51602
1507,1609245938.0,False,False,False,False,False,False,t5_mouw,r/science,27112673,"People who grow up with aggressive parents are more likely to use anger words such as “mad,” “hate,” and “stupid” when annoyed or irritated with romantic partners. These moments can escalate into more intense conflict, unless we stop repeating our parents’ communication patterns.",/r/science/comments/kmdrhr/people_who_grow_up_with_aggressive_parents_are/,40,0,1,883,13,,51593
1508,1556730870.0,False,False,False,False,False,False,t5_mouw,r/science,27112673,"In 1980, a monk found a jawbone high up in a Tibetan cave. Now, a re-analysis shows the remains belonged to a Denisovan who died there 160,000 years ago. It's just the second known site where the extinct humans lived, and it shows they colonized extreme elevations long before our own ancestors did.",/r/science/comments/bjjq0a/in_1980_a_monk_found_a_jawbone_high_up_in_a/,2,0,0,1464,15,,51553
1509,1602833900.0,False,False,False,False,False,False,t5_mouw,r/science,27112673,"New research could help millions who suffer from ‘ringing in the ears’: Researchers show that combining sound and electrical stimulation of the tongue can significantly reduce tinnitus, commonly described as “ringing in the ears”; therapeutic effects can sustain for up to 12 months post-treatment",/r/science/comments/jc5m6y/new_research_could_help_millions_who_suffer_from/,77,0,1,1976,37,,51542
1510,1598805495.0,False,False,False,False,False,False,t5_mouw,r/science,27112673,"New evidence confirming the 'frustration-affirmation' hypothesis. When American gun-owners have their goals thwarted, their heightened frustration causes them to (accidentally) shoot more unarmed targets in a firearm simulation, a bias for violence especially in men with low education.",/r/science/comments/ijfo7c/new_evidence_confirming_the/,23,0,1,2058,23,,51471
1511,1576207963.0,False,False,False,False,False,False,t5_mouw,r/science,27112673,"Social media and television use — but not video games — predict depression and anxiety in teens, suggests a new study (n=3,659, grades 7 to 10). Gaming has become more of a social activity, with the average gamer no longer socially isolated, and more than 70% of gamers playing games with a friend.",/r/science/comments/e9yh4y/social_media_and_television_use_but_not_video/,0,0,0,957,20,,51443
1512,1520680441.0,False,False,False,False,False,False,t5_mouw,r/science,27112673,"Scientists create nanowood, a new material that is as insulating as Styrofoam but lighter and 30 times stronger, doesn’t cause allergies and is much more environmentally friendly, by removing lignin from wood, which turns it completely white. The research is published in Science Advances.",/r/science/comments/83el6m/scientists_create_nanowood_a_new_material_that_is/,0,0,0,998,2,,51440
1513,1567011691.0,False,False,False,False,False,False,t5_mouw,r/science,27112673,"The first computer chip made with thousands of carbon nanotubes, not silicon, marks a computing milestone. Carbon nanotube chips may ultimately give rise to a new generation of faster, more energy-efficient electronics.",/r/science/comments/cwnktf/the_first_computer_chip_made_with_thousands_of/,0,0,0,1257,20,,51412
1514,1521040498.0,False,False,False,False,False,False,t5_mouw,r/science,27112673,"Astronomers discover that all disk galaxies rotate once every billion years, no matter their size or shape. Lead author: “Discovering such regularity in galaxies really helps us to better understand the mechanics that make them tick.”",/r/science/comments/84e4yq/astronomers_discover_that_all_disk_galaxies/,0,0,0,1613,6,,51328
1515,1581612343.0,False,False,False,False,False,False,t5_mouw,r/science,27112673,"People with social anxiety tend to have a harder time remembering social scenarios that end positively, according to new research published in the journal Cognition and Emotion. The study provides more evidence that social anxiety is related to biases in memory.",/r/science/comments/f3cqoc/people_with_social_anxiety_tend_to_have_a_harder/,2,0,0,749,26,,51279
1516,1577998288.0,False,False,False,False,False,False,t5_mouw,r/science,27112673,"Earliest roasted root vegetables found in 170,000-year-old cave dirt, reports new study in journal Science, which suggests the real “paleo diet” included lots of roasted vegetables rich in carbohydrates, similar to modern potatoes.",/r/science/comments/ej42p5/earliest_roasted_root_vegetables_found_in/,2,0,0,1741,16,,51233
1517,1537828861.0,False,False,False,False,False,False,t5_mouw,r/science,27112673,"Honey bees exposed to glyphosate, the active ingredient in Roundup, lose some of the beneficial bacteria in their guts and are more susceptible to infection and death from harmful bacteria. Glyphosate might be contributing to the decline of honey bees and native bees around the world.",/r/science/comments/9immmj/honey_bees_exposed_to_glyphosate_the_active/,1,0,1,1261,17,,51230
1518,1511347221.0,False,False,False,False,False,False,t5_mouw,r/science,27112673,A new study finds that patients who can legally treat themselves with medical cannabis stop using prescription opioids or use fewer opiates to care for chronic pain symptoms.,/r/science/comments/7eq1w0/a_new_study_finds_that_patients_who_can_legally/,0,0,0,1407,4,,51224
1519,1493734098.0,False,False,False,False,False,False,t5_mouw,r/science,27112673,"Many important antibiotics, like penicillin, are produced by fungi. Now, microbiologists have discovered that two fungal species cooperate to synthesize an antibiotic that neither produces when grown alone. The antibiotic kills MRSA, as well as the bacteria that cause anthrax and strep throat.",/r/science/comments/68tbui/many_important_antibiotics_like_penicillin_are/,0,0,0,1116,0,,51219
1520,1618056944.0,False,False,False,False,False,False,t5_mouw,r/science,27112673,"Having a responsive, supportive partner minimizes the negative impacts of an individual’s depression or external stress on their romantic relationship. A responsive partner is one who focuses effort and energy to listen without reacting, tries to understand, and be supportive in a helpful way.",/r/science/comments/mo3lt8/having_a_responsive_supportive_partner_minimizes/,101,0,0,1176,16,,51182
1521,1591022667.0,False,False,False,False,False,False,t5_mouw,r/science,27112673,"Men and Women Misperceive What the Opposite Sex Finds Attractive. Women overestimated men's preference for thinness in female partners. At the same time, men overestimated women's preference for muscularity in male partners.",/r/science/comments/gulv9s/men_and_women_misperceive_what_the_opposite_sex/,1,0,1,1850,22,,51156
1522,1566565726.0,False,False,False,False,False,False,t5_mouw,r/science,27112673,"Like humans, crows are more optimistic after making tools to solve a problem",/r/science/comments/cudnl2/like_humans_crows_are_more_optimistic_after/,0,0,0,576,11,,51141
1523,1622327744.0,False,False,False,False,False,False,t5_mouw,r/science,27112673,"Men die of suicide much more often than women. This is commonly blamed on men's unwillingness to seek help and talk about their problems. This paper disputes the conventional view, emphasizing instead socio-economic issues and obstacles to health care access",/r/science/comments/nnxx02/men_die_of_suicide_much_more_often_than_women/,97,0,3,3562,24,,51094
1524,1621894033.0,False,False,False,False,False,False,t5_mouw,r/science,27112673,A blind man can perceive objects after a gene from algae was added to his eye: MIT Technology Review,/r/science/comments/nk9r1z/a_blind_man_can_perceive_objects_after_a_gene/,67,0,0,575,17,,51073
1525,1546846101.0,False,False,False,False,False,False,t5_mouw,r/science,27112673,"Americans are happier in states where governments spend more on public goods, among them libraries, parks, highways, natural resources and police protection, a Baylor University study has found.",/r/science/comments/adfcz8/americans_are_happier_in_states_where_governments/,0,0,0,2429,16,,51054
1526,1617135779.0,False,False,False,False,False,False,t5_mouw,r/science,27112673,"Competition is not helping keep insulin prices low - Drug companies raised the price of insulin about 10% each time a new type of insulin cleared the third and the final stages toward FDA approval, according to new research that sheds light on a flawed health system.",/r/science/comments/mgp3k6/competition_is_not_helping_keep_insulin_prices/,35,0,0,1864,13,,50989
1527,1516573173.0,False,False,False,False,False,False,t5_mouw,r/science,27112673,"The average rooster crow is about 130 dB, about the same volume as standing 15m from a jet taking off. To prevent deafness from their own calls, roosters have evolved soft tissue that covers half of the eardrum while crowing.",/r/science/comments/7s114q/the_average_rooster_crow_is_about_130_db_about/,0,0,0,1478,2,,50987
1528,1633435019.0,False,False,False,False,False,False,t5_mouw,r/science,27112673,"Intramuscular injections can accidentally hit a vein, causing injection into the bloodstream. This could explain rare adverse reactions to Covid-19 vaccine. Study shows solid link between intravenous mRNA vaccine and myocarditis (in mice). Needle aspiration is one way to avoid this from happening.",/r/science/comments/q1uud9/intramuscular_injections_can_accidentally_hit_a/,27,0,0,2974,23,,50983
1529,1617444090.0,False,False,False,False,False,False,t5_mouw,r/science,27112673,"Microdosing psychedelic drugs is associated with increases in conscientiousness and reductions in neuroticism, finds a new Australian study, which may explain the positive effects on performance and psychological well-being respectively.",/r/science/comments/mj5mp9/microdosing_psychedelic_drugs_is_associated_with/,81,0,0,1482,16,,50963
1530,1569870675.0,False,False,False,False,False,False,t5_mouw,r/science,27112673,"Scientists present new evidence that great apes possess the “theory of mind,” which means they can attribute mental states to themselves and others, and also understand that others may believe different information than they do.",/r/science/comments/dbgkfs/scientists_present_new_evidence_that_great_apes/,0,0,0,978,15,,50949
1531,1609846554.0,False,False,False,False,False,False,t5_mouw,r/science,27112673,Deforestation dropped by 18 percent in two years in African countries where organizations subscribed to receive warnings from a new service using satellites to detect decreases in forest cover in the tropics. The carbon emissions avoided were worth between $149 million and $696 million,/r/science/comments/kqws6k/deforestation_dropped_by_18_percent_in_two_years/,117,0,0,421,11,,50941
1532,1514088935.0,False,False,False,False,False,False,t5_mouw,r/science,27112673,"A discovery that microbes in Antarctica can scavenge hydrogen, carbon monoxide and carbon dioxide from the air to stay alive in such extreme conditions has implications for the search for life on other planets.",/r/science/comments/7lt6rq/a_discovery_that_microbes_in_antarctica_can/,0,0,0,1019,0,,50939
1533,1615667565.0,False,False,False,False,False,False,t5_mouw,r/science,27112673,"Breakup-induced confusion about one’s self-identity helps explain the desire to get back together with an ex-partner. Romantic breakups can shake our sense of identity. After the dissolution of a relationship, people can feel as if a part of themselves has gone missing.",/r/science/comments/m4eqfv/breakupinduced_confusion_about_ones_selfidentity/,68,0,0,1448,17,,50927
1534,1580891521.0,False,False,False,False,False,False,t5_mouw,r/science,27112673,"Cuba’s rivers run clean after decades of sustainable farming. Despite the island’s history of large-scale agriculture, the rivers studied had much lower levels of dissolved nitrogen — an indicator of fertilizer use — than did the Mississippi River Basin in the United States.",/r/science/comments/ez6gy0/cubas_rivers_run_clean_after_decades_of/,1,0,0,1764,29,,50901
1535,1567548610.0,False,False,False,False,False,False,t5_mouw,r/science,27112673,"A theory that Parkinson's disease can arise in the intestinal system and from there migrate to the brain has now gained support from new research, after seeing the disease migrate from the gut to the brain and heart of laboratory rats via the peripheral nerves.",/r/science/comments/czbpgx/a_theory_that_parkinsons_disease_can_arise_in_the/,3,0,0,1617,20,,50889
1536,1611792333.0,False,False,False,False,False,False,t5_mouw,r/science,27112673,Legal cannabis stores linked to fewer opioid deaths in the United States. Findings may have implications for tackling opioid misuse. An increase from one to two dispensaries in a county was associated with an estimated 17% reduction in all opioid related mortality rates.,/r/science/comments/l6iemw/legal_cannabis_stores_linked_to_fewer_opioid/,82,0,0,935,27,,50889
1537,1566335466.0,False,False,False,False,False,False,t5_mouw,r/science,27112673,"Individuals who post a lot of selfies are almost uniformly viewed as less likeable, less successful, more insecure and less open to new experiences than individuals who share a greater number of posed photos taken by someone else, suggests a new study that compared selfies to posies.",/r/science/comments/ct6ahh/individuals_who_post_a_lot_of_selfies_are_almost/,1,0,0,1419,15,,50863
1538,1597360284.0,False,False,False,False,False,False,t5_mouw,r/science,27112673,New research provides evidence that psychedelic drugs can improve mental health by making individuals more accepting of distressing experiences. The study adds to a growing body of literature that indicates using substances like psilocybin can result in sustain improvements in depressive symptoms.,/r/science/comments/i9ajyj/new_research_provides_evidence_that_psychedelic/,67,0,1,1760,25,,50844
1539,1520591351.0,False,False,False,False,False,False,t5_mouw,r/science,27112673,"Doing lots of exercise in older age can prevent the immune system from declining and protect people against infections. Scientists followed 125 long-distance cyclists, some now in their 80s, and found they had the immune systems of 20-year-olds. The research was published in the journal Aging Cell.",/r/science/comments/835qwp/doing_lots_of_exercise_in_older_age_can_prevent/,0,0,0,1556,10,,50809
1540,1602546698.0,False,False,False,False,False,False,t5_mouw,r/science,27112673,First Confirmed Cases of COVID-19 Reinfections in US,/r/science/comments/ja2fdj/first_confirmed_cases_of_covid19_reinfections_in/,46,0,0,2442,11,,50800
1541,1616493612.0,False,False,False,False,False,False,t5_mouw,r/science,27112673,"Vaccination by inhalation: MIT researchers delivered vaccines directly to the lungs boosting immune responses to viral infections or lung cancer. Vaccinated mice were able to eliminate metastatic melanoma, and the vaccine helped to shrink existing lung tumors. (Science Immunology, 19 Mar 2021)",/r/science/comments/mbb9jn/vaccination_by_inhalation_mit_researchers/,93,0,0,699,8,,50778
1542,1567925949.0,False,False,False,False,False,False,t5_mouw,r/science,27112673,"Doctors have identified previously unrecognized characteristic of the vaping-related respiratory illness that has been emerging in clusters across the U.S. in recent months. Within the lungs of these patients are large immune cells containing numerous oily droplets, called lipid-laden macrophages.",/r/science/comments/d17qm9/doctors_have_identified_previously_unrecognized/,4,0,2,4233,22,,50784
1543,1526175307.0,False,False,False,False,False,False,t5_mouw,r/science,27112673,"Plastic Bag Found at the Bottom of World's Deepest Ocean Trench - It is now the deepest known piece of plastic trash, found at a depth of 36,000 feet inside the Mariana Trench.",/r/science/comments/8j0lqn/plastic_bag_found_at_the_bottom_of_worlds_deepest/,0,0,0,1304,8,,50775
1544,1594355865.0,False,False,False,False,False,False,t5_mouw,r/science,27112673,"""We find that 37% of jobs in the United States can be performed entirely at home, with significant variation across cities and industries. These jobs typically pay more than jobs that cannot be done at home and account for 46% of all US wages.""",/r/science/comments/hoildl/we_find_that_37_of_jobs_in_the_united_states_can/,0,0,0,2656,20,,50762
1545,1619384621.0,False,False,False,False,False,False,t5_mouw,r/science,27112673,"A large, longitudinal study in Canada has unequivocally refuted the idea that epidural anesthesia increases the risk of autism in children. Among more than 120,000 vaginal births, researchers found no evidence for any genuine link between this type of pain medication and autism spectrum disorder.",/r/science/comments/myhkyb/a_large_longitudinal_study_in_canada_has/,42,0,0,1285,7,,50750
1546,1610747825.0,False,False,False,False,False,False,t5_mouw,r/science,27112673,"Raising the minimum wage by $1 reduces the teen birth rate by 3%, according to a new study examining U.S. state-level data.",/r/science/comments/ky4xb3/raising_the_minimum_wage_by_1_reduces_the_teen/,37,0,0,1177,6,,50731
1547,1619865662.0,False,False,False,False,False,False,t5_mouw,r/science,27112673,"Houses in flood zones in the US are currently overvalued by a total of $43.8 billion based on information in publicly available flood hazard maps, raising concerns about the stability of real estate markets as climate risks become more severe.",/r/science/comments/n2fv1n/houses_in_flood_zones_in_the_us_are_currently/,31,0,0,2153,26,,50731
1548,1586843406.0,False,False,False,False,False,False,t5_mouw,r/science,27112673,Hospital Visits Declined After Sulfur Dioxide Reductions from Louisville-Area Coal Plants. A new study found a 55 percent reduction in lung-irritating pollutants and 400 fewer hospital admissions after one coal plant closed and others added scrubbers.,/r/science/comments/g0zw9e/hospital_visits_declined_after_sulfur_dioxide/,2,0,0,1005,17,,50697
1549,1608769151.0,False,False,False,False,False,False,t5_mouw,r/science,27112673,Experiencing the illusion of having an opposite-sex body in virtual reality can shift aspects of gender identity. An experiment involving the illusion of owning an opposite-sex body led people to embrace a more equal identification with both genders.,/r/science/comments/kj4s23/experiencing_the_illusion_of_having_an/,57,0,1,2263,17,,50684
1550,1639913927.0,False,False,False,False,False,False,t5_mouw,r/science,27112673,"The pandemic has shown a new way to reduce climate change: scrap in-person meetings & conventions. Moving a professional conference completely online reduces its carbon footprint by 94%, and shifting it to a hybrid model, with no more than half of conventioneers online, curtails the footprint to 67%",/r/science/comments/rjv2i1/the_pandemic_has_shown_a_new_way_to_reduce/,32,0,0,2043,5,,50616
1551,1617357105.0,False,False,False,False,False,False,t5_mouw,r/science,27112673,"Women are perceived differently from men — even when they're robots. Female bots are perceived to have more positive human qualities, such as warmth, experience and emotion, than male bots, and this greater humanness leads consumers to prefer female artificial intelligence, a new study has found.",/r/science/comments/mih2id/women_are_perceived_differently_from_men_even/,45,0,0,2848,15,,50537
1552,1601934229.0,False,False,False,False,False,False,t5_mouw,r/science,27112673,We Now Have Proof a Supernova Exploded Perilously Close to Earth 2.5 Million Years Ago,/r/science/comments/j5slfc/we_now_have_proof_a_supernova_exploded_perilously/,76,0,0,1790,8,,50535
1553,1515499196.0,False,False,False,False,False,False,t5_mouw,r/science,27112673,"In Alzheimer’s disease, tau, an abnormal protein, spreads in a prion-like manner from neuron to neuron within the brain, similar to the spread of an infection, to cause nerve cell death, finds a new study using advance brain imaging. Blocking its spread may prevent the disease from taking hold.",/r/science/comments/7p6n9h/in_alzheimers_disease_tau_an_abnormal_protein/,0,0,0,781,2,,50534
1554,1574796038.0,False,False,False,False,False,False,t5_mouw,r/science,27112673,"Working-age Americans dying at higher rates, especially in economically hard-hit states: A new VCU study identifies “a distinctly American phenomenon” as mortality among 25 to 64 year-olds increases and U.S. life expectancy continues to fall.",/r/science/comments/e22wu3/workingage_americans_dying_at_higher_rates/,1,0,1,3746,29,,50507
1555,1538874827.0,False,False,False,False,False,False,t5_mouw,r/science,27112673,"Scientists develop a universal vaccine platform that’s cheaper and shelf stable, cutting the cost of vaccine production and storage by 80% without decreasing safety or effectiveness - the vaccine will not expire at warm temperatures and could be stockpiled at room temperature for years.",/r/science/comments/9m1blc/scientists_develop_a_universal_vaccine_platform/,0,0,0,588,2,,50485
1556,1559933486.0,False,False,False,False,False,False,t5_mouw,r/science,27112673,An increase in cocoa price of up to 47% may be necessary to eliminate all child labor from cocoa production in Ghana,/r/science/comments/bxyb48/an_increase_in_cocoa_price_of_up_to_47_may_be/,0,0,0,1900,8,,50385
1557,1521474525.0,False,False,False,False,False,False,t5_mouw,r/science,27112673,"Self-employed people are happier and more engaged at work despite working longer hours and having less job security, according to a study of 5,000 workers",/r/science/comments/85kgt6/selfemployed_people_are_happier_and_more_engaged/,0,0,0,2090,4,,50372
